ID,NAME,TITLE,DATE,LOCATION,GITHUB,TEXT
bitnaughts,BitNaughts,Open Source Rules the Galaxy,Ongoing,https://github.com/bitnaughts,tbd,
seerauber,Seerauber,Polygonal Pirates Prowling the Pacific,Ongoing,https://github.com/plebeiathon/seerauber,tbd,
spaceninjas,Space Ninjas,Intro to Game Design 2D Platformer,2015,https://github.com/Mutilar/SpaceNinjas,tbd,
voodoo,Voodoo,Minion-Swarming Madness,2015,https://github.com/Mutilar/Voodoo,tbd,
graviton,Graviton,Retro Sci-fi Tower Defense,2016,https://github.com/Mutilar/Graviton,tbd,
